{
  "type": "AdaptiveCard",
  "version": "1.5",
  "$schema": "http://adaptivecards.io/schemas/adaptive-card.json",
  "body": [
    {
      "type": "TextBlock",
      "text": "Publish Adaptive Card Schema",
      "weight": "Bolder",
      "size": "Medium"
    },
    {
      "type": "ColumnSet",
      "columns": [
        {
          "type": "Column",
          "width": "auto",
          "items": [
            {
              "type": "Image",
              "url": "https://adaptivecards.io/content/cats/1.png",
              "size": "Small",
              "style": "Person"
            }
          ]
        },
        {
          "type": "Column",
          "width": "stretch",
          "items": [
            {
              "type": "TextBlock",
              "text": "Matt Hidinger",
              "weight": "Bolder",
              "wrap": true
            },
            {
              "type": "TextBlock",
              "text": "Created Tuesday, Feb 14, 2026",
              "spacing": "None",
              "isSubtle": true,
              "wrap": true
            }
          ]
        }
      ]
    },
    {
      "type": "TextBlock",
      "text": "Now that we have defined the main rules and features of the format, we need to produce a schema and publish it to GitHub.",
      "wrap": true
    },
    {
      "type": "FactSet",
      "facts": [
        {
          "title": "Board:",
          "value": "Adaptive Cards"
        },
        {
          "title": "List:",
          "value": "Backlog"
        },
        {
          "title": "Assigned to:",
          "value": "Matt Hidinger"
        },
        {
          "title": "Due date:",
          "value": "Not set"
        }
      ]
    }
  ],
  "actions": [
    {
      "type": "Action.ShowCard",
      "title": "Set due date",
      "card": {
        "type": "AdaptiveCard",
        "body": [
          {
            "type": "Input.Date",
            "id": "dueDate"
          }
        ],
        "actions": [
          {
            "type": "Action.Submit",
            "title": "OK"
          }
        ]
      }
    },
    {
      "type": "Action.ShowCard",
      "title": "Comment",
      "card": {
        "type": "AdaptiveCard",
        "body": [
          {
            "type": "Input.Text",
            "id": "comment",
            "isMultiline": true,
            "placeholder": "Enter your comment"
          }
        ],
        "actions": [
          {
            "type": "Action.Submit",
            "title": "OK"
          }
        ]
      }
    }
  ]
}
