{
  "type": "AdaptiveCard",
  "version": "1.6",
  "body": [
    {
      "type": "TextBlock",
      "text": "Rating Example",
      "weight": "bolder",
      "size": "large"
    },
    {
      "type": "TextBlock",
      "text": "Display Rating (Read-only)",
      "weight": "bolder"
    },
    {
      "type": "Container",
      "style": "emphasis",
      "items": [
        {
          "type": "TextBlock",
          "text": "Product A",
          "weight": "bolder"
        },
        {
          "type": "Rating",
          "id": "rating1",
          "value": 4.5,
          "max": 5,
          "count": 127,
          "size": "medium"
        },
        {
          "type": "TextBlock",
          "text": "127 reviews",
          "size": "small",
          "isSubtle": true
        }
      ]
    },
    {
      "type": "TextBlock",
      "text": "Small Rating Display",
      "weight": "bolder"
    },
    {
      "type": "Rating",
      "id": "rating2",
      "value": 3.8,
      "max": 5,
      "count": 45,
      "size": "small"
    },
    {
      "type": "TextBlock",
      "text": "Large Rating Display",
      "weight": "bolder"
    },
    {
      "type": "Rating",
      "id": "rating3",
      "value": 5.0,
      "max": 5,
      "count": 5,
      "size": "large"
    },
    {
      "type": "TextBlock",
      "text": "Interactive Rating Input",
      "weight": "bolder"
    },
    {
      "type": "Input.Rating",
      "id": "ratingInput1",
      "label": "Rate this product",
      "max": 5,
      "value": 0,
      "isRequired": true,
      "errorMessage": "Please provide a rating"
    },
    {
      "type": "Input.Rating",
      "id": "ratingInput2",
      "label": "How satisfied are you?",
      "max": 10,
      "value": 7
    }
  ],
  "actions": [
    {
      "type": "Action.Submit",
      "title": "Submit Rating"
    }
  ]
}
